[
  {
    "slug": "art",
    "name": "Art",
    "file": "catalog/art.csv",
    "isDefault": true,
    "idBlock": [
      1,
      9999
    ],
    "itemPath": "books"
  },
  {
    "slug": "zz",
    "name": "ZZ",
    "file": "catalog/zz.csv",
    "idBlock": [
      9000,
      19999
    ],
    "itemPath": "books"
  }
]
