[
  {
    "slug": "art",
    "name": "Art & Photography",
    "file": "books.csv",
    "isDefault": true,
    "live": true,
    "idBlock": [1, 9999],
    "allowLegacyIds": [],
    "itemPath": "books",
    "classifications": ["Photographer Monograph", "Artist Monograph", "Artist Book", "Photobook", "Periodical", "Zine", "Ephemera"],
    "defaultGrouping": "",
    "intro": "",
    "featuredTags": []
  },
  {
    "slug": "cryptology",
    "name": "Cryptology",
    "file": "catalog/cryptology.csv",
    "live": true,
    "idBlock": [10001, 19999],
    "allowLegacyIds": [],
    "itemPath": "books",
    "classifications": ["Monograph", "Textbook", "Manual", "Declassified Report", "Periodical", "Ephemera"],
    "defaultGrouping": "Cryptology",
    "intake": "catalogued",
    "intro": "Cryptography and its popular life. William Friedman's cryptanalysis manuals and the NSA's own declassified histories sit here beside Usborne code books for children and the privacy law of the 1990s: secret writing as a technical discipline, and as something everybody has played at.",
    "featuredTags": ["Codes and Ciphers"]
  },
  {
    "slug": "hacking",
    "name": "Cracking & Hacking",
    "file": "catalog/hacking.csv",
    "live": true,
    "idBlock": [100001, 109999],
    "allowLegacyIds": [10037],
    "itemPath": "books",
    "classifications": ["Monograph", "Manual", "Textbook", "Zine", "Periodical", "Ephemera"],
    "defaultGrouping": "Cracking & Hacking",
    "intake": "catalogued",
    "intro": "The hacker underground publishing itself. The complete run of 2600: The Hacker Quarterly, from the 1984 monthlies to the current quarterly, sits here with the manuals the same scene wrote for its own use: phone phreaking, lock picking, network intrusion and the law that chased all three, written by the people doing it.",
    "featuredTags": []
  },
  {
    "slug": "media-theory",
    "name": "Media Theory",
    "file": "catalog/media-theory.csv",
    "live": false,
    "idBlock": [110001, 119999],
    "allowLegacyIds": [],
    "itemPath": "books",
    "classifications": ["Monograph", "Anthology", "Essay Collection", "Memoir", "Reportage", "Textbook", "Periodical"],
    "defaultGrouping": "Media Theory",
    "intake": "catalogued",
    "intro": "",
    "featuredTags": []
  },
  {
    "slug": "digital-art",
    "name": "Digital Art & AI",
    "file": "catalog/digital-art.csv",
    "live": false,
    "idBlock": [120001, 129999],
    "allowLegacyIds": [],
    "itemPath": "books",
    "classifications": ["Monograph", "Anthology", "Essay Collection", "Exhibition Catalog", "Textbook", "Periodical"],
    "defaultGrouping": "Digital Art & AI",
    "intake": "catalogued",
    "intro": "",
    "featuredTags": []
  },
  {
    "slug": "art-writing",
    "name": "Art Writing & Lives",
    "file": "catalog/art-writing.csv",
    "live": false,
    "idBlock": [130001, 139999],
    "allowLegacyIds": [],
    "itemPath": "books",
    "classifications": ["Monograph", "Essay Collection", "Anthology", "Interviews", "Artist's Writings", "Biography", "Memoir", "Diary"],
    "defaultGrouping": "Art Writing & Lives",
    "intake": "catalogued",
    "intro": "",
    "featuredTags": []
  },
  {
    "slug": "surveillance",
    "name": "Surveillance & Dissent",
    "file": "catalog/surveillance.csv",
    "live": false,
    "idBlock": [140001, 149999],
    "allowLegacyIds": [],
    "itemPath": "books",
    "classifications": ["Monograph", "Anthology", "Essay Collection", "Manual", "Reportage", "Exhibition Catalog", "Periodical"],
    "defaultGrouping": "Surveillance & Dissent",
    "intake": "catalogued",
    "intro": "",
    "featuredTags": []
  },
  {
    "slug": "fiction",
    "name": "Fiction & Non-fiction",
    "file": "catalog/fiction.csv",
    "live": false,
    "idBlock": [20001, 39999],
    "allowLegacyIds": [],
    "itemPath": "books",
    "classifications": [],
    "defaultGrouping": "",
    "intake": "catalogued",
    "intro": "",
    "featuredTags": []
  },
  {
    "slug": "ephemera",
    "name": "Ephemera",
    "file": "catalog/ephemera.csv",
    "live": true,
    "idBlock": [40001, 69999],
    "allowLegacyIds": [],
    "itemPath": "objects",
    "classifications": ["Sticker", "Invitation", "Booklet", "Postcard", "Card", "Press Kit", "Flyer", "Picture", "Ephemera"],
    "defaultGrouping": "Ephemera",
    "intro": "",
    "featuredTags": []
  },
  {
    "slug": "comics",
    "name": "Comics",
    "file": "catalog/comics.csv",
    "live": false,
    "idBlock": [70001, 79999],
    "allowLegacyIds": [],
    "itemPath": "books",
    "classifications": ["Graphic Novel", "Comic Book", "Anthology", "Manga", "Strip Collection", "Zine"],
    "defaultGrouping": "Comics",
    "intro": "",
    "featuredTags": []
  },
  {
    "slug": "posters",
    "name": "Posters",
    "file": "catalog/posters.csv",
    "live": true,
    "idBlock": [80001, 89999],
    "allowLegacyIds": [],
    "itemPath": "objects",
    "classifications": ["Poster", "Broadside"],
    "defaultGrouping": "Posters",
    "intro": "",
    "featuredTags": []
  },
  {
    "slug": "artworks",
    "name": "Artworks",
    "file": "catalog/artworks.csv",
    "live": false,
    "idBlock": [90001, 99999],
    "allowLegacyIds": [],
    "itemPath": "objects",
    "classifications": ["Print", "Painting", "Photograph", "Drawing"],
    "defaultGrouping": "Artworks",
    "intro": "",
    "featuredTags": []
  }
]
